Package Name,Version,Official Link,Creator,Creator Profile Link,Description
buffer-layout,1.2.2,https://www.npmjs.com/package/buffer-layout,pabigot,https://www.npmjs.com/~pabigot,Translation between JavaScript values and Buffers
sip.js,0.21.2,https://www.npmjs.com/package/sip.js,john-e-riordan,https://www.npmjs.com/~john-e-riordan,A SIP library for JavaScript
@googlemaps/js-api-loader,2.0.2,https://www.npmjs.com/package/@googlemaps/js-api-loader,google-wombot,https://www.npmjs.com/~google-wombot,Wrapper for the loading of Google Maps JavaScript API script in the browser
@ngageoint/mgrs-js,1.0.0,https://www.npmjs.com/package/@ngageoint/mgrs-js,kgilland,https://www.npmjs.com/~kgilland,MGRS Javascript
loglevel,1.9.2,https://www.npmjs.com/package/loglevel,pimterry,https://www.npmjs.com/~pimterry,"Minimal lightweight logging for JavaScript, adding reliable log level methods to any available console.log methods"
@fidm/x509,1.2.1,https://www.npmjs.com/package/@fidm/x509,zensh,https://www.npmjs.com/~zensh,Pure JavaScript X509 certificate tools for Node.js
@ibm/telemetry-js,1.11.0,https://www.npmjs.com/package/@ibm/telemetry-js,carbon-design-system,https://www.npmjs.com/~carbon-design-system,JavaScript telemetry tooling for open/inner source projects
injection-js,2.6.1,https://www.npmjs.com/package/injection-js,mgechev,https://www.npmjs.com/~mgechev,Dependency Injection library for JavaScript and TypeScript
spark-md5,3.0.2,https://www.npmjs.com/package/spark-md5,satazor,https://www.npmjs.com/~satazor,Lightning fast normal and incremental md5 for javascript
modern-tar,0.7.6,https://www.npmjs.com/package/modern-tar,GitHub Actions,https://www.npmjs.com/~GitHub Actions,Zero dependency streaming tar parser and writer for JavaScript.
@shikijs/engine-javascript,4.0.2,https://www.npmjs.com/package/@shikijs/engine-javascript,GitHub Actions,https://www.npmjs.com/~GitHub Actions,Engine for Shiki using JavaScript's native RegExp
@esbuild/linux-s390x,0.28.0,https://www.npmjs.com/package/@esbuild/linux-s390x,GitHub Actions,https://www.npmjs.com/~GitHub Actions,"The Linux IBM Z 64-bit Big Endian binary for esbuild, a JavaScript bundler."
@urbit/nockjs,1.6.0,https://www.npmjs.com/package/@urbit/nockjs,nocsyx-lassul,https://www.npmjs.com/~nocsyx-lassul,Javascript urbit runtime
@oxlint/binding-darwin-arm64,1.62.0,https://www.npmjs.com/package/@oxlint/binding-darwin-arm64,GitHub Actions,https://www.npmjs.com/~GitHub Actions,Linter for the JavaScript Oxidation Compiler
chrono-node,2.9.0,https://www.npmjs.com/package/chrono-node,wanasit,https://www.npmjs.com/~wanasit,A natural language date parser in Javascript
@oxfmt/binding-linux-arm64-gnu,0.47.0,https://www.npmjs.com/package/@oxfmt/binding-linux-arm64-gnu,GitHub Actions,https://www.npmjs.com/~GitHub Actions,Formatter for the JavaScript Oxidation Compiler
punycode,2.3.1,https://www.npmjs.com/package/punycode,google-wombot,https://www.npmjs.com/~google-wombot,"A robust Punycode converter that fully complies to RFC 3492 and RFC 5891, and works on nearly all JavaScript platforms."
gremlin,3.8.1,https://www.npmjs.com/package/gremlin,xiazcy,https://www.npmjs.com/~xiazcy,JavaScript Gremlin Language Variant
impit-linux-x64-gnu,0.13.1,https://www.npmjs.com/package/impit-linux-x64-gnu,GitHub Actions,https://www.npmjs.com/~GitHub Actions,Impit for JavaScript
@poppinss/dumper,0.7.0,https://www.npmjs.com/package/@poppinss/dumper,virk,https://www.npmjs.com/~virk,Pretty print JavaScript data types in the terminal and the browser
rete,2.0.6,https://www.npmjs.com/package/rete,ni55an,https://www.npmjs.com/~ni55an,JavaScript framework
snappyjs,0.7.0,https://www.npmjs.com/package/snappyjs,zhipengjia,https://www.npmjs.com/~zhipengjia,JavaScript implementation of Google's Snappy compression library
radix3,1.1.2,https://www.npmjs.com/package/radix3,pi0,https://www.npmjs.com/~pi0,Lightweight and fast router for JavaScript based on Radix Tree
@ngageoint/color-js,2.1.0,https://www.npmjs.com/package/@ngageoint/color-js,kgilland,https://www.npmjs.com/~kgilland,Color Javascript
agora-rtm-sdk,2.2.4,https://www.npmjs.com/package/agora-rtm-sdk,jocelyn_0,https://www.npmjs.com/~jocelyn_0,JavaScript SDK for Agora RTM
datatables.net,2.3.8,https://www.npmjs.com/package/datatables.net,datatables,https://www.npmjs.com/~datatables,DataTables - The Javascript table library
@oxlint/binding-linux-arm64-gnu,1.62.0,https://www.npmjs.com/package/@oxlint/binding-linux-arm64-gnu,GitHub Actions,https://www.npmjs.com/~GitHub Actions,Linter for the JavaScript Oxidation Compiler
grunt-babel,8.0.0,https://www.npmjs.com/package/grunt-babel,loganfsmyth,https://www.npmjs.com/~loganfsmyth,"Use next generation JavaScript, today"
js-sdsl,4.4.2,https://www.npmjs.com/package/js-sdsl,yaozilong,https://www.npmjs.com/~yaozilong,javascript standard data structure library which benchmark against C++ STL
sherif,1.11.1,https://www.npmjs.com/package/sherif,quiibz,https://www.npmjs.com/~quiibz,"Opinionated, zero-config linter for TypeScript & JavaScript monorepos"
node-fetch-native,1.6.7,https://www.npmjs.com/package/node-fetch-native,pi0,https://www.npmjs.com/~pi0,better fetch for Node.js. Works on any JavaScript runtime!
jstz,2.1.1,https://www.npmjs.com/package/jstz,iansinnott,https://www.npmjs.com/~iansinnott,Timezone detection for JavaScript
image-meta,0.2.2,https://www.npmjs.com/package/image-meta,pi0,https://www.npmjs.com/~pi0,Detect image type and size using pure javascript
@plotly/d3,3.8.2,https://www.npmjs.com/package/@plotly/d3,archmoj,https://www.npmjs.com/~archmoj,A JavaScript visualization library for HTML and SVG.
@bytecodealliance/jco,1.19.0,https://www.npmjs.com/package/@bytecodealliance/jco,GitHub Actions,https://www.npmjs.com/~GitHub Actions,JavaScript tooling for working with WebAssembly Components
@cantoo/pdf-lib,2.6.5,https://www.npmjs.com/package/@cantoo/pdf-lib,sharcoux,https://www.npmjs.com/~sharcoux,Create and modify PDF files with JavaScript
require-addon,1.2.0,https://www.npmjs.com/package/require-addon,kasperisager,https://www.npmjs.com/~kasperisager,Import native addons across JavaScript runtimes
kuromoji,0.1.2,https://www.npmjs.com/package/kuromoji,takuyaa,https://www.npmjs.com/~takuyaa,JavaScript implementation of Japanese morphological analyzer
@tensorflow/tfjs-data,4.22.0,https://www.npmjs.com/package/@tensorflow/tfjs-data,delhibabu,https://www.npmjs.com/~delhibabu,TensorFlow Data API in JavaScript
@xml-tools/parser,1.0.11,https://www.npmjs.com/package/@xml-tools/parser,oss_rima_bot,https://www.npmjs.com/~oss_rima_bot,XML Parser Implemented in JavaScript
utf8,3.0.0,https://www.npmjs.com/package/utf8,mathias,https://www.npmjs.com/~mathias,A well-tested UTF-8 encoder/decoder written in JavaScript.
uri-js,4.4.1,https://www.npmjs.com/package/uri-js,garycourt,https://www.npmjs.com/~garycourt,"An RFC 3986/3987 compliant, scheme extendable URI/IRI parsing/validating/resolving library for JavaScript."
@logtail/tools,0.5.8,https://www.npmjs.com/package/@logtail/tools,logtail,https://www.npmjs.com/~logtail,Better Stack JavaScript logging tools (formerly Logtail)
zeparser,0.0.7,https://www.npmjs.com/package/zeparser,felixge,https://www.npmjs.com/~felixge,My JavaScript parser
fibers,5.0.3,https://www.npmjs.com/package/fibers,laverdet,https://www.npmjs.com/~laverdet,Cooperative multi-tasking for Javascript
@mendable/firecrawl-js,4.20.0,https://www.npmjs.com/package/@mendable/firecrawl-js,hello_sideguide,https://www.npmjs.com/~hello_sideguide,JavaScript SDK for Firecrawl API
turbo,2.9.6,https://www.npmjs.com/package/turbo,GitHub Actions,https://www.npmjs.com/~GitHub Actions,Turborepo is a high-performance build system for JavaScript and TypeScript codebases.
voca,1.4.1,https://www.npmjs.com/package/voca,panzerdp,https://www.npmjs.com/~panzerdp,The ultimate JavaScript string library
geotiff,3.0.5,https://www.npmjs.com/package/geotiff,constantinius,https://www.npmjs.com/~constantinius,GeoTIFF image decoding in JavaScript
wolfy87-eventemitter,5.2.9,https://www.npmjs.com/package/wolfy87-eventemitter,olical,https://www.npmjs.com/~olical,Event based JavaScript for the browser
mp4box,2.3.0,https://www.npmjs.com/package/mp4box,denizatgpac,https://www.npmjs.com/~denizatgpac,JavaScript version of GPAC's MP4Box tool
attr-accept,2.2.5,https://www.npmjs.com/package/attr-accept,rolandjitsu,https://www.npmjs.com/~rolandjitsu,"JavaScript implementation of the ""accept"" attribute for HTML5 <input type=""file"">"
@novu/js,3.16.0,https://www.npmjs.com/package/@novu/js,GitHub Actions,https://www.npmjs.com/~GitHub Actions,Novu JavaScript SDK for <Inbox />
sherif-linux-x64,1.11.1,https://www.npmjs.com/package/sherif-linux-x64,quiibz,https://www.npmjs.com/~quiibz,"Opinionated, zero-config linter for TypeScript & JavaScript monorepos"
ag-charts-types,13.2.1,https://www.npmjs.com/package/ag-charts-types,GitHub Actions,https://www.npmjs.com/~GitHub Actions,Advanced Charting / Charts supporting Javascript / Typescript / React / Angular / Vue
cst,0.4.10,https://www.npmjs.com/package/cst,markelog,https://www.npmjs.com/~markelog,JavaScript CST Implementation
flatqueue,3.0.0,https://www.npmjs.com/package/flatqueue,mourner,https://www.npmjs.com/~mourner,The smallest and simplest JavaScript priority queue
vega-time,3.1.0,https://www.npmjs.com/package/vega-time,lhermann,https://www.npmjs.com/~lhermann,JavaScript date/time utilities for Vega.
@splitsoftware/splitio-browserjs,1.7.0,https://www.npmjs.com/package/@splitsoftware/splitio-browserjs,ezamora.split,https://www.npmjs.com/~ezamora.split,Split SDK for JavaScript on Browser
stimulus,3.2.2,https://www.npmjs.com/package/stimulus,dhh,https://www.npmjs.com/~dhh,Stimulus JavaScript framework
fmix,1.0.0,https://www.npmjs.com/package/fmix,linusu,https://www.npmjs.com/~linusu,MurmurHash3 x86 finalization mix implemented in JavaScript.
constantinople,4.0.1,https://www.npmjs.com/package/constantinople,forbeslindesay,https://www.npmjs.com/~forbeslindesay,Determine whether a JavaScript expression evaluates to a constant
downloadjs,1.4.7,https://www.npmjs.com/package/downloadjs,rndme,https://www.npmjs.com/~rndme,file downloading using client-side javascript
mime-lite,1.0.3,https://www.npmjs.com/package/mime-lite,asaianudeep,https://www.npmjs.com/~asaianudeep,Standard mime types for JavaScript
@chamaeleonidae/chmln,1.0.1,https://www.npmjs.com/package/@chamaeleonidae/chmln,bnorton,https://www.npmjs.com/~bnorton,The official chameleon.io JavaScript client library
@lit-labs/signals,0.2.0,https://www.npmjs.com/package/@lit-labs/signals,GitHub Actions,https://www.npmjs.com/~GitHub Actions,JavaScript Signals proposal integration for Lit
unbuild,3.6.1,https://www.npmjs.com/package/unbuild,pi0,https://www.npmjs.com/~pi0,A unified JavaScript build system
nitropack,2.13.3,https://www.npmjs.com/package/nitropack,pi0,https://www.npmjs.com/~pi0,Build and Deploy Universal JavaScript Servers
is-lite,2.0.0,https://www.npmjs.com/package/is-lite,GitHub Actions,https://www.npmjs.com/~GitHub Actions,A tiny javascript type testing tool
framesync,6.1.2,https://www.npmjs.com/package/framesync,popmotion,https://www.npmjs.com/~popmotion,A frame-synced render loop for JavaScript
gleap,15.3.2,https://www.npmjs.com/package/gleap,boehlerlukas,https://www.npmjs.com/~boehlerlukas,![Gleap JavaScript SDK Intro](https://github.com/GleapSDK/JavaScript-SDK/blob/master/resources/banner.png?raw=true)
knip,6.7.0,https://www.npmjs.com/package/knip,webpro,https://www.npmjs.com/~webpro,"Find and fix unused dependencies, exports and files in your TypeScript and JavaScript projects"
paho-mqtt,1.1.0,https://www.npmjs.com/package/paho-mqtt,jpwsutton,https://www.npmjs.com/~jpwsutton,Eclipse Paho JavaScript MQTT client for Browsers
@aws-sdk/client-sts,3.1038.0,https://www.npmjs.com/package/@aws-sdk/client-sts,aws-sdk-bot,https://www.npmjs.com/~aws-sdk-bot,"AWS SDK for JavaScript Sts Client for Node.js, Browser and React Native"
@algolia/client-common,5.51.0,https://www.npmjs.com/package/@algolia/client-common,GitHub Actions,https://www.npmjs.com/~GitHub Actions,Common package for the Algolia JavaScript API client.
ltx,3.1.2,https://www.npmjs.com/package/ltx,sonny,https://www.npmjs.com/~sonny,"<xml for=""JavaScript"">"
@oxfmt/binding-darwin-arm64,0.47.0,https://www.npmjs.com/package/@oxfmt/binding-darwin-arm64,GitHub Actions,https://www.npmjs.com/~GitHub Actions,Formatter for the JavaScript Oxidation Compiler
impit-linux-x64-musl,0.13.1,https://www.npmjs.com/package/impit-linux-x64-musl,GitHub Actions,https://www.npmjs.com/~GitHub Actions,Impit for JavaScript
ix,7.0.0,https://www.npmjs.com/package/ix,ptaylor,https://www.npmjs.com/~ptaylor,The Interactive Extensions for JavaScript
bare-assert,1.2.0,https://www.npmjs.com/package/bare-assert,kasperisager,https://www.npmjs.com/~kasperisager,Assertion library for JavaScript
cidaas-javascript-sdk,5.1.4,https://www.npmjs.com/package/cidaas-javascript-sdk,cidaasnpm,https://www.npmjs.com/~cidaasnpm,Cidaas native javascript sdk
@cyclonedx/cyclonedx-library,10.0.0,https://www.npmjs.com/package/@cyclonedx/cyclonedx-library,GitHub Actions,https://www.npmjs.com/~GitHub Actions,Core functionality of CycloneDX for JavaScript (Node.js or WebBrowser).
snapsvg,0.5.1,https://www.npmjs.com/package/snapsvg,dmitrybaranovskiy,https://www.npmjs.com/~dmitrybaranovskiy,JavaScript Vector Library
jsbi,4.3.2,https://www.npmjs.com/package/jsbi,google-wombot,https://www.npmjs.com/~google-wombot,"JSBI is a pure-JavaScript implementation of [the ECMAScript BigInt proposal](https://tc39.es/proposal-bigint/), which officially became a part of the JavaScript language in ES2020."
@turf/turf,7.3.5,https://www.npmjs.com/package/@turf/turf,GitHub Actions,https://www.npmjs.com/~GitHub Actions,a JavaScript library for performing geospatial operations with GeoJSON
showdown,2.1.0,https://www.npmjs.com/package/showdown,tivie,https://www.npmjs.com/~tivie,A Markdown to HTML converter written in Javascript
buffer-crc32,1.0.0,https://www.npmjs.com/package/buffer-crc32,kibertoad,https://www.npmjs.com/~kibertoad,A pure javascript CRC32 algorithm that plays nice with binary data
@syncfusion/ej2-excel-export,33.2.3,https://www.npmjs.com/package/@syncfusion/ej2-excel-export,syncfusion-javascript,https://www.npmjs.com/~syncfusion-javascript,Essential Javascript 2 Excel Export Library
@bitgo-beta/utxo-lib,2.4.1,https://www.npmjs.com/package/@bitgo-beta/utxo-lib,bitgoaaron,https://www.npmjs.com/~bitgoaaron,Client-side Bitcoin JavaScript library
gif.js,0.2.0,https://www.npmjs.com/package/gif.js,jnordberg,https://www.npmjs.com/~jnordberg,JavaScript GIF encoding library
zca-js,2.1.2,https://www.npmjs.com/package/zca-js,rfs-adreno,https://www.npmjs.com/~rfs-adreno,Unofficial Zalo API for JavaScript
vt-pbf,3.1.3,https://www.npmjs.com/package/vt-pbf,mourner,https://www.npmjs.com/~mourner,Serialize mapbox vector tiles to binary protobufs in javascript.
croppie,2.6.5,https://www.npmjs.com/package/croppie,dbsy9d,https://www.npmjs.com/~dbsy9d,A simple javascript image cropper
es-cookie,1.5.0,https://www.npmjs.com/package/es-cookie,theodorejb,https://www.npmjs.com/~theodorejb,A JavaScript module for handling cookies
decode-formdata,0.9.0,https://www.npmjs.com/package/decode-formdata,fabian-hiller,https://www.npmjs.com/~fabian-hiller,Decodes complex FormData into a JavaScript object
@launchdarkly/js-client-sdk,4.6.3,https://www.npmjs.com/package/@launchdarkly/js-client-sdk,GitHub Actions,https://www.npmjs.com/~GitHub Actions,LaunchDarkly SDK for JavaScript in Browsers
safe-identifier,0.4.2,https://www.npmjs.com/package/safe-identifier,eemeli,https://www.npmjs.com/~eemeli,Sanitize strings for use as JavaScript identifiers & property names
mock-socket,9.3.1,https://www.npmjs.com/package/mock-socket,atrue,https://www.npmjs.com/~atrue,Javascript mocking library for websockets and socket.io
@oxlint/binding-darwin-x64,1.62.0,https://www.npmjs.com/package/@oxlint/binding-darwin-x64,GitHub Actions,https://www.npmjs.com/~GitHub Actions,Linter for the JavaScript Oxidation Compiler
infinispan,0.13.0,https://www.npmjs.com/package/infinispan,GitHub Actions,https://www.npmjs.com/~GitHub Actions,Infinispan Javascript client
ssim.js,3.5.0,https://www.npmjs.com/package/ssim.js,obartra,https://www.npmjs.com/~obartra,JavaScript implementation of the SSIM algorithm
undeclared-identifiers,1.1.3,https://www.npmjs.com/package/undeclared-identifiers,goto-bus-stop,https://www.npmjs.com/~goto-bus-stop,find undeclared identifiers and property accesses in a javascript file.
get-set-props,0.2.0,https://www.npmjs.com/package/get-set-props,dustinspecker,https://www.npmjs.com/~dustinspecker,List of getter/setter properties for JavaScript types
xpath.js,1.1.0,https://www.npmjs.com/package/xpath.js,yaron,https://www.npmjs.com/~yaron,Xpath pure javascript implementation for node.js
@oxlint/binding-win32-x64-msvc,1.62.0,https://www.npmjs.com/package/@oxlint/binding-win32-x64-msvc,GitHub Actions,https://www.npmjs.com/~GitHub Actions,Linter for the JavaScript Oxidation Compiler
amazon-chime-sdk-js,3.30.0,https://www.npmjs.com/package/amazon-chime-sdk-js,GitHub Actions,https://www.npmjs.com/~GitHub Actions,Amazon Chime SDK for JavaScript
@oxlint/binding-linux-arm64-musl,1.62.0,https://www.npmjs.com/package/@oxlint/binding-linux-arm64-musl,GitHub Actions,https://www.npmjs.com/~GitHub Actions,Linter for the JavaScript Oxidation Compiler
tap,21.7.1,https://www.npmjs.com/package/tap,isaacs,https://www.npmjs.com/~isaacs,A Test-Anything-Protocol library for JavaScript
@amplitude/experiment-js-client,1.21.0,https://www.npmjs.com/package/@amplitude/experiment-js-client,GitHub Actions,https://www.npmjs.com/~GitHub Actions,Amplitude Experiment Javascript Client SDK
@aerisweather/javascript-sdk,1.8.6,https://www.npmjs.com/package/@aerisweather/javascript-sdk,oliver.alexander.aw,https://www.npmjs.com/~oliver.alexander.aw,Core Javascript library shared across multiple projects
@turnkey/sdk-server,5.3.0,https://www.npmjs.com/package/@turnkey/sdk-server,GitHub Actions,https://www.npmjs.com/~GitHub Actions,JavaScript Server SDK
bidc,0.0.4,https://www.npmjs.com/package/bidc,quietshu,https://www.npmjs.com/~quietshu,Bidirectional Channel for JavaScript
cardinal,2.1.1,https://www.npmjs.com/package/cardinal,thlorenz,https://www.npmjs.com/~thlorenz,Syntax highlights JavaScript code with ANSI colors to be printed to the terminal.
safe-flat,2.1.0,https://www.npmjs.com/package/safe-flat,jessie-codes,https://www.npmjs.com/~jessie-codes,Safely flatten a nested JavaScript object.
diffusion,6.12.1,https://www.npmjs.com/package/diffusion,push_technology,https://www.npmjs.com/~push_technology,Diffusion JavaScript client
tau-prolog,0.3.4,https://www.npmjs.com/package/tau-prolog,jariazavalverde,https://www.npmjs.com/~jariazavalverde,An open source Prolog interpreter in JavaScript
array-timsort,1.0.3,https://www.npmjs.com/package/array-timsort,kael,https://www.npmjs.com/~kael,Fast JavaScript array sorting by implementing Python's Timsort algorithm
filestack-js,3.50.4,https://www.npmjs.com/package/filestack-js,filestack-dev,https://www.npmjs.com/~filestack-dev,Official JavaScript library for Filestack
fusioncharts,4.2.2,https://www.npmjs.com/package/fusioncharts,meherhowji,https://www.npmjs.com/~meherhowji,FusionCharts JavaScript charting framework
libsodium-wrappers,0.8.4,https://www.npmjs.com/package/libsodium-wrappers,jedisct1,https://www.npmjs.com/~jedisct1,The Sodium cryptographic library compiled to pure JavaScript (wrappers)
@launchdarkly/js-client-sdk-common,1.26.1,https://www.npmjs.com/package/@launchdarkly/js-client-sdk-common,GitHub Actions,https://www.npmjs.com/~GitHub Actions,LaunchDarkly Client SDK for JavaScript - common code
medium-zoom,1.1.0,https://www.npmjs.com/package/medium-zoom,francoischalifour,https://www.npmjs.com/~francoischalifour,A JavaScript library for zooming images like Medium
glob-to-regex.js,1.2.0,https://www.npmjs.com/package/glob-to-regex.js,streamich,https://www.npmjs.com/~streamich,Transform GLOB patterns to JavaScript regular expressions for fast file path matching.
typeforce,1.18.0,https://www.npmjs.com/package/typeforce,dcousens,https://www.npmjs.com/~dcousens,Another biased type checking solution for Javascript
gherkin-lint,4.2.4,https://www.npmjs.com/package/gherkin-lint,andrewnicols,https://www.npmjs.com/~andrewnicols,A Gherkin linter/validator written in javascript
@canvasjs/charts,3.15.19,https://www.npmjs.com/package/@canvasjs/charts,canvasjs,https://www.npmjs.com/~canvasjs,CanvasJS JavaScript Charts - Official
@microsoft/applicationinsights-web-basic,3.4.1,https://www.npmjs.com/package/@microsoft/applicationinsights-web-basic,microsoft1es,https://www.npmjs.com/~microsoft1es,Microsoft Application Insights JavaScript SDK - Web Basic
babel-literal-to-ast,2.1.0,https://www.npmjs.com/package/babel-literal-to-ast,izaakschroeder,https://www.npmjs.com/~izaakschroeder,Turn JavaScript objects into their AST representation.
sonarqube-scanner,4.3.6,https://www.npmjs.com/package/sonarqube-scanner,GitHub Actions,https://www.npmjs.com/~GitHub Actions,SonarQube/SonarCloud Scanner for the JavaScript world
@solana-program/memo,0.11.0,https://www.npmjs.com/package/@solana-program/memo,joncinque,https://www.npmjs.com/~joncinque,JavaScript client for the Memo program
decomment,0.9.5,https://www.npmjs.com/package/decomment,vitaly.tomilov,https://www.npmjs.com/~vitaly.tomilov,"Removes comments from JSON/JavaScript, CSS/HTML, CPP/H, etc."
inputmask,5.0.9,https://www.npmjs.com/package/inputmask,robinherbots,https://www.npmjs.com/~robinherbots,"Inputmask is a javascript library which creates an input mask.  Inputmask can run against vanilla javascript, jQuery and jqlite."
nouislider,15.8.1,https://www.npmjs.com/package/nouislider,leongersen,https://www.npmjs.com/~leongersen,noUiSlider is a lightweight JavaScript range slider.
@oxlint/binding-win32-arm64-msvc,1.62.0,https://www.npmjs.com/package/@oxlint/binding-win32-arm64-msvc,GitHub Actions,https://www.npmjs.com/~GitHub Actions,Linter for the JavaScript Oxidation Compiler
regression,2.0.1,https://www.npmjs.com/package/regression,tom-alexander,https://www.npmjs.com/~tom-alexander,Javascript least squares data fitting methods
gradle-to-js,2.0.1,https://www.npmjs.com/package/gradle-to-js,karllindmark,https://www.npmjs.com/~karllindmark,A quick & dirty Gradle build file to JavaScript object parser
@vavt/util,2.1.2,https://www.npmjs.com/package/@vavt/util,imzbf,https://www.npmjs.com/~imzbf,JavaScript library.
@oxfmt/binding-win32-x64-msvc,0.47.0,https://www.npmjs.com/package/@oxfmt/binding-win32-x64-msvc,GitHub Actions,https://www.npmjs.com/~GitHub Actions,Formatter for the JavaScript Oxidation Compiler
imagescript,1.3.1,https://www.npmjs.com/package/imagescript,matmen,https://www.npmjs.com/~matmen,zero-dependency javascript image manipulation
variable-diff,2.0.2,https://www.npmjs.com/package/variable-diff,taylorhakes,https://www.npmjs.com/~taylorhakes,Visual diff between javascript variables
hcl2-parser,1.0.3,https://www.npmjs.com/package/hcl2-parser,bencuk,https://www.npmjs.com/~bencuk,HCL v2 parser for JavaScript
obug,2.1.1,https://www.npmjs.com/package/obug,GitHub Actions,https://www.npmjs.com/~GitHub Actions,"A lightweight JavaScript debugging utility, forked from debug, featuring TypeScript and ESM support."
@bitgo/utxo-lib,11.22.0,https://www.npmjs.com/package/@bitgo/utxo-lib,GitHub Actions,https://www.npmjs.com/~GitHub Actions,Client-side Bitcoin JavaScript library
cssesc,3.0.0,https://www.npmjs.com/package/cssesc,mathias,https://www.npmjs.com/~mathias,A JavaScript library for escaping CSS strings and identifiers while generating the shortest possible ASCII-only output.
smartsheet,4.7.2,https://www.npmjs.com/package/smartsheet,smartsheet-platform,https://www.npmjs.com/~smartsheet-platform,Smartsheet JavaScript client SDK
@oxfmt/binding-darwin-x64,0.47.0,https://www.npmjs.com/package/@oxfmt/binding-darwin-x64,GitHub Actions,https://www.npmjs.com/~GitHub Actions,Formatter for the JavaScript Oxidation Compiler
aws-sdk-mock,6.2.2,https://www.npmjs.com/package/aws-sdk-mock,luchoturtle,https://www.npmjs.com/~luchoturtle,Functions to mock the JavaScript aws-sdk
int64-buffer,1.1.0,https://www.npmjs.com/package/int64-buffer,kawanet,https://www.npmjs.com/~kawanet,64bit Long Integer on Buffer/Array/ArrayBuffer in Pure JavaScript
ziggy-js,2.6.2,https://www.npmjs.com/package/ziggy-js,GitHub Actions,https://www.npmjs.com/~GitHub Actions,Use your Laravel named routes in JavaScript.
@translated/lara,1.9.1,https://www.npmjs.com/package/@translated/lara,translatedteam,https://www.npmjs.com/~translatedteam,Official Lara SDK for JavaScript and Node.js
jsmin,1.0.1,https://www.npmjs.com/package/jsmin,pkrumins,https://www.npmjs.com/~pkrumins,A node.js module for javascript minification
modelo,4.2.3,https://www.npmjs.com/package/modelo,kevinconway,https://www.npmjs.com/~kevinconway,A JavaScript object inheritance utility.
javascript-blowfish,1.0.4,https://www.npmjs.com/package/javascript-blowfish,thesunlover,https://www.npmjs.com/~thesunlover,"Blowfish encryption library Javascript, jquery,coffeescript (blowfish.js)"
alpinejs,3.15.11,https://www.npmjs.com/package/alpinejs,GitHub Actions,https://www.npmjs.com/~GitHub Actions,"The rugged, minimal JavaScript framework"
electron,41.3.0,https://www.npmjs.com/package/electron,electron-nightly,https://www.npmjs.com/~electron-nightly,"Build cross platform desktop apps with JavaScript, HTML, and CSS"
webpack-remove-empty-scripts,1.1.1,https://www.npmjs.com/package/webpack-remove-empty-scripts,webdiscus,https://www.npmjs.com/~webdiscus,Webpack plugin removes empty JavaScript files generated when using styles.
lamejs,1.2.1,https://www.npmjs.com/package/lamejs,zhuker,https://www.npmjs.com/~zhuker,Pure JavaScript MP3 Encoder
