Package Name,Version,Official Link,Creator,Creator Profile Link,Description
@esbuild/darwin-x64,0.28.0,https://www.npmjs.com/package/@esbuild/darwin-x64,GitHub Actions,https://www.npmjs.com/~GitHub Actions,"The macOS 64-bit binary for esbuild, a JavaScript bundler."
is,3.3.2,https://www.npmjs.com/package/is,ljharb,https://www.npmjs.com/~ljharb,the definitive JavaScript type testing library
@esbuild/openbsd-x64,0.28.0,https://www.npmjs.com/package/@esbuild/openbsd-x64,GitHub Actions,https://www.npmjs.com/~GitHub Actions,"The OpenBSD 64-bit binary for esbuild, a JavaScript bundler."
tinyqueue,3.0.0,https://www.npmjs.com/package/tinyqueue,mourner,https://www.npmjs.com/~mourner,The smallest and simplest JavaScript priority queue
astring,1.9.0,https://www.npmjs.com/package/astring,davidbonnet,https://www.npmjs.com/~davidbonnet,JavaScript code generator from an ESTree-compliant AST.
@esbuild/linux-arm64,0.28.0,https://www.npmjs.com/package/@esbuild/linux-arm64,GitHub Actions,https://www.npmjs.com/~GitHub Actions,"The Linux ARM 64-bit binary for esbuild, a JavaScript bundler."
fzf,0.5.2,https://www.npmjs.com/package/fzf,ajitid,https://www.npmjs.com/~ajitid,Do fuzzy matching using FZF algorithm in JavaScript
@esbuild/sunos-x64,0.28.0,https://www.npmjs.com/package/@esbuild/sunos-x64,GitHub Actions,https://www.npmjs.com/~GitHub Actions,"The illumos 64-bit binary for esbuild, a JavaScript bundler."
viewerjs,1.11.7,https://www.npmjs.com/package/viewerjs,chenfengyuan,https://www.npmjs.com/~chenfengyuan,JavaScript image viewer.
java-parser,3.0.1,https://www.npmjs.com/package/java-parser,jtkiesel,https://www.npmjs.com/~jtkiesel,Java Parser in JavaScript
@oxlint/binding-linux-x64-gnu,1.62.0,https://www.npmjs.com/package/@oxlint/binding-linux-x64-gnu,GitHub Actions,https://www.npmjs.com/~GitHub Actions,Linter for the JavaScript Oxidation Compiler
estree-util-value-to-estree,3.5.0,https://www.npmjs.com/package/estree-util-value-to-estree,GitHub Actions,https://www.npmjs.com/~GitHub Actions,Convert a JavaScript value to an estree expression
@oxfmt/binding-linux-x64-gnu,0.47.0,https://www.npmjs.com/package/@oxfmt/binding-linux-x64-gnu,GitHub Actions,https://www.npmjs.com/~GitHub Actions,Formatter for the JavaScript Oxidation Compiler
@esbuild/freebsd-x64,0.28.0,https://www.npmjs.com/package/@esbuild/freebsd-x64,GitHub Actions,https://www.npmjs.com/~GitHub Actions,"The FreeBSD 64-bit binary for esbuild, a JavaScript bundler."
d3-time-format,4.1.0,https://www.npmjs.com/package/d3-time-format,mbostock,https://www.npmjs.com/~mbostock,A JavaScript time formatter and parser inspired by strftime and strptime.
@exercism/eslint-config-javascript,0.8.1,https://www.npmjs.com/package/@exercism/eslint-config-javascript,sleeplessbyte,https://www.npmjs.com/~sleeplessbyte,ESLint configuration for the JavaScript track on Exercism
@esbuild/win32-ia32,0.28.0,https://www.npmjs.com/package/@esbuild/win32-ia32,GitHub Actions,https://www.npmjs.com/~GitHub Actions,"The Windows 32-bit binary for esbuild, a JavaScript bundler."
multicast-dns,7.2.5,https://www.npmjs.com/package/multicast-dns,mafintosh,https://www.npmjs.com/~mafintosh,Low level multicast-dns implementation in pure javascript
@launchdarkly/js-server-sdk-common,2.18.5,https://www.npmjs.com/package/@launchdarkly/js-server-sdk-common,GitHub Actions,https://www.npmjs.com/~GitHub Actions,LaunchDarkly Server SDK for JavaScript - common code
@livelike/javascript,1.4.1-alpha.0,https://www.npmjs.com/package/@livelike/javascript,naveennayyar007,https://www.npmjs.com/~naveennayyar007,LiveLike Javascript package
quickselect,3.0.0,https://www.npmjs.com/package/quickselect,mourner,https://www.npmjs.com/~mourner,A tiny and fast selection algorithm in JavaScript.
xml-js,1.6.11,https://www.npmjs.com/package/xml-js,nashwaan,https://www.npmjs.com/~nashwaan,A convertor between XML text and Javascript object / JSON text.
@octokit/auth-oauth-device,8.0.3,https://www.npmjs.com/package/@octokit/auth-oauth-device,octokitbot,https://www.npmjs.com/~octokitbot,GitHub OAuth Device authentication strategy for JavaScript
html-minifier,4.0.0,https://www.npmjs.com/package/html-minifier,alexlamsl,https://www.npmjs.com/~alexlamsl,"Highly configurable, well-tested, JavaScript-based HTML minifier."
essentials,1.2.0,https://www.npmjs.com/package/essentials,medikoo,https://www.npmjs.com/~medikoo,Essential initialization for every JavaScript process
@bugsnag/browser,8.9.0,https://www.npmjs.com/package/@bugsnag/browser,sb-priyankap,https://www.npmjs.com/~sb-priyankap,Bugsnag error reporter for browser JavaScript
@jsforce/jsforce-node,3.10.14,https://www.npmjs.com/package/@jsforce/jsforce-node,salesforce-releases,https://www.npmjs.com/~salesforce-releases,Salesforce API Library for JavaScript
validate.js,0.13.1,https://www.npmjs.com/package/validate.js,ansman,https://www.npmjs.com/~ansman,Declarative validations for JavaScript
jdenticon,3.3.0,https://www.npmjs.com/package/jdenticon,dmester,https://www.npmjs.com/~dmester,Javascript identicon generator
@snowplow/tracker-core,4.8.0,https://www.npmjs.com/package/@snowplow/tracker-core,snowplow-analytics,https://www.npmjs.com/~snowplow-analytics,Core functionality for Snowplow JavaScript trackers
@vercel/blob,2.3.3,https://www.npmjs.com/package/@vercel/blob,vercel-release-bot,https://www.npmjs.com/~vercel-release-bot,The Vercel Blob JavaScript API client
@azure/storage-queue,12.29.0,https://www.npmjs.com/package/@azure/storage-queue,microsoft1es,https://www.npmjs.com/~microsoft1es,Microsoft Azure Storage SDK for JavaScript - Queue
encoding-japanese,2.2.0,https://www.npmjs.com/package/encoding-japanese,polygonplanet,https://www.npmjs.com/~polygonplanet,Convert and detect character encoding in JavaScript
node-xmllint,1.0.0,https://www.npmjs.com/package/node-xmllint,tib-tib,https://www.npmjs.com/~tib-tib,```javascript
vega-util,2.1.0,https://www.npmjs.com/package/vega-util,lhermann,https://www.npmjs.com/~lhermann,JavaScript utilities for Vega.
kd-tree-javascript,1.0.3,https://www.npmjs.com/package/kd-tree-javascript,greennot,https://www.npmjs.com/~greennot,A basic but super fast JavaScript implementation of the k-dimensional tree data structure.
is-expression,4.0.0,https://www.npmjs.com/package/is-expression,forbeslindesay,https://www.npmjs.com/~forbeslindesay,Check if a string is a valid JavaScript expression
js-library-detector,6.7.0,https://www.npmjs.com/package/js-library-detector,housseindjirdeh,https://www.npmjs.com/~housseindjirdeh,Detects the JavaScript libraries running on a page
@esbuild/linux-ia32,0.28.0,https://www.npmjs.com/package/@esbuild/linux-ia32,GitHub Actions,https://www.npmjs.com/~GitHub Actions,"The Linux 32-bit binary for esbuild, a JavaScript bundler."
@teppeis/multimaps,3.0.0,https://www.npmjs.com/package/@teppeis/multimaps,teppeis,https://www.npmjs.com/~teppeis,Multimap classes for TypeScript and JavaScript
@microsoft/applicationinsights-shims,3.0.1,https://www.npmjs.com/package/@microsoft/applicationinsights-shims,msftapplicationinsights,https://www.npmjs.com/~msftapplicationinsights,Microsoft Application Insights JavaScript SDK - Shim functions
livekit-client,2.18.7,https://www.npmjs.com/package/livekit-client,GitHub Actions,https://www.npmjs.com/~GitHub Actions,JavaScript/TypeScript client SDK for LiveKit
@microsoft/applicationinsights-web,3.4.1,https://www.npmjs.com/package/@microsoft/applicationinsights-web,microsoft1es,https://www.npmjs.com/~microsoft1es,Microsoft Application Insights JavaScript SDK - Web
identifier-regex,1.0.1,https://www.npmjs.com/package/identifier-regex,sindresorhus,https://www.npmjs.com/~sindresorhus,Regular expression for matching JavaScript identifiers
@vis.gl/react-google-maps,1.8.3,https://www.npmjs.com/package/@vis.gl/react-google-maps,GitHub Actions,https://www.npmjs.com/~GitHub Actions,React components and hooks for the Google Maps JavaScript API
extract-zip,2.0.1,https://www.npmjs.com/package/extract-zip,malept,https://www.npmjs.com/~malept,unzip a zip file into a directory using 100% javascript
@crowdin/crowdin-api-client,1.55.1,https://www.npmjs.com/package/@crowdin/crowdin-api-client,GitHub Actions,https://www.npmjs.com/~GitHub Actions,JavaScript library for Crowdin API
hast-util-to-estree,3.1.3,https://www.npmjs.com/package/hast-util-to-estree,wooorm,https://www.npmjs.com/~wooorm,hast utility to transform to estree (JavaScript AST) JSX
mnemonist,0.40.3,https://www.npmjs.com/package/mnemonist,yomguithereal,https://www.npmjs.com/~yomguithereal,Curated collection of data structures for the JavaScript/TypeScript.
nearley,2.20.1,https://www.npmjs.com/package/nearley,hardmath123,https://www.npmjs.com/~hardmath123,"Simple, fast, powerful parser toolkit for JavaScript."
eslint-config-standard-jsx,11.0.0,https://www.npmjs.com/package/eslint-config-standard-jsx,voxpelli,https://www.npmjs.com/~voxpelli,JavaScript Standard Style JSX support - ESLint Shareable Config
@esbuild/darwin-arm64,0.28.0,https://www.npmjs.com/package/@esbuild/darwin-arm64,GitHub Actions,https://www.npmjs.com/~GitHub Actions,"The macOS ARM 64-bit binary for esbuild, a JavaScript bundler."
@contentstack/utils,1.9.1,https://www.npmjs.com/package/@contentstack/utils,cloudaccounts,https://www.npmjs.com/~cloudaccounts,Contentstack utilities for Javascript
intl-tel-input,28.0.2,https://www.npmjs.com/package/intl-tel-input,GitHub Actions,https://www.npmjs.com/~GitHub Actions,A JavaScript plugin for entering and validating international telephone numbers
mutexify,1.4.0,https://www.npmjs.com/package/mutexify,mafintosh,https://www.npmjs.com/~mafintosh,mutex lock for javascript
png-js,2.0.0,https://www.npmjs.com/package/png-js,diegomura,https://www.npmjs.com/~diegomura,A PNG decoder in JavaScript
dot,1.1.3,https://www.npmjs.com/package/dot,esp,https://www.npmjs.com/~esp,Concise and fast javascript templating compatible with nodejs and other javascript environments
@exercism/babel-preset-javascript,0.7.0,https://www.npmjs.com/package/@exercism/babel-preset-javascript,sleeplessbyte,https://www.npmjs.com/~sleeplessbyte,Babel preset configuration for the JavaScript track on Exercism
@cucumber/cucumber,12.8.2,https://www.npmjs.com/package/@cucumber/cucumber,GitHub Actions,https://www.npmjs.com/~GitHub Actions,The official JavaScript implementation of Cucumber.
@js-sdsl/ordered-map,4.4.2,https://www.npmjs.com/package/@js-sdsl/ordered-map,yaozilong,https://www.npmjs.com/~yaozilong,javascript standard data structure library which benchmark against C++ STL
strftime,0.10.3,https://www.npmjs.com/package/strftime,sjs,https://www.npmjs.com/~sjs,strftime for JavaScript
@solana/buffer-layout,4.0.1,https://www.npmjs.com/package/@solana/buffer-layout,steveluscher,https://www.npmjs.com/~steveluscher,Translation between JavaScript values and Buffers
@azure/service-bus,7.9.5,https://www.npmjs.com/package/@azure/service-bus,microsoft1es,https://www.npmjs.com/~microsoft1es,Azure Service Bus SDK for JavaScript
@boldreports/javascript-reporting-controls,13.1.29,https://www.npmjs.com/package/@boldreports/javascript-reporting-controls,bold-reports,https://www.npmjs.com/~bold-reports,The Bold Reports by Syncfusion controls for JavaScript contains ReportViewer and ReportDesigner HTML5 and JavaScript reporting controls for enterprise web development
uuidv7,1.2.1,https://www.npmjs.com/package/uuidv7,liosk,https://www.npmjs.com/~liosk,A JavaScript implementation of UUID version 7
tosource,2.0.0-alpha.3,https://www.npmjs.com/package/tosource,marcello,https://www.npmjs.com/~marcello,toSource converts JavaScript objects back to source
leaflet,1.9.4,https://www.npmjs.com/package/leaflet,mourner,https://www.npmjs.com/~mourner,JavaScript library for mobile-friendly interactive maps
libphonenumber-js,1.12.42,https://www.npmjs.com/package/libphonenumber-js,catamphetamine,https://www.npmjs.com/~catamphetamine,A simpler (and smaller) rewrite of Google Android's libphonenumber library in javascript
socketcluster-client,20.0.1,https://www.npmjs.com/package/socketcluster-client,topcloudsystems,https://www.npmjs.com/~topcloudsystems,SocketCluster JavaScript client
@oxlint/binding-linux-x64-musl,1.62.0,https://www.npmjs.com/package/@oxlint/binding-linux-x64-musl,GitHub Actions,https://www.npmjs.com/~GitHub Actions,Linter for the JavaScript Oxidation Compiler
@solana/promises,6.8.0,https://www.npmjs.com/package/@solana/promises,GitHub Actions,https://www.npmjs.com/~GitHub Actions,Helpers for using JavaScript promises
esbuild-wasm,0.28.0,https://www.npmjs.com/package/esbuild-wasm,GitHub Actions,https://www.npmjs.com/~GitHub Actions,"The cross-platform WebAssembly binary for esbuild, a JavaScript bundler."
amplify-frontend-javascript,3.7.6,https://www.npmjs.com/package/amplify-frontend-javascript,aws-amplify-ops,https://www.npmjs.com/~aws-amplify-ops,amplify-cli front-end plugin for JavaScript projects
@esbuild/android-arm64,0.28.0,https://www.npmjs.com/package/@esbuild/android-arm64,GitHub Actions,https://www.npmjs.com/~GitHub Actions,"The Android ARM 64-bit binary for esbuild, a JavaScript bundler."
esast-util-from-js,2.0.1,https://www.npmjs.com/package/esast-util-from-js,wooorm,https://www.npmjs.com/~wooorm,estree (and esast) utility to parse from JavaScript
@microsoft/applicationinsights-analytics-js,3.4.1,https://www.npmjs.com/package/@microsoft/applicationinsights-analytics-js,microsoft1es,https://www.npmjs.com/~microsoft1es,Microsoft Application Insights JavaScript SDK - Web Analytics
density-clustering,1.3.0,https://www.npmjs.com/package/density-clustering,lukaszkrawczyk,https://www.npmjs.com/~lukaszkrawczyk,Density Based Clustering in JavaScript
@egjs/hammerjs,2.0.17,https://www.npmjs.com/package/@egjs/hammerjs,woodneck,https://www.npmjs.com/~woodneck,A javascript library for multi-touch gestures
@types/javascript-natural-sort,0.7.0,https://www.npmjs.com/package/@types/javascript-natural-sort,types,https://www.npmjs.com/~types,TypeScript definitions for javascript-natural-sort
@open-wc/dedupe-mixin,2.0.1,https://www.npmjs.com/package/@open-wc/dedupe-mixin,modern-web,https://www.npmjs.com/~modern-web,Dedupe JavaScript Class Mixins
@esbuild/win32-arm64,0.28.0,https://www.npmjs.com/package/@esbuild/win32-arm64,GitHub Actions,https://www.npmjs.com/~GitHub Actions,"The Windows ARM 64-bit binary for esbuild, a JavaScript bundler."
libhoney,4.3.1,https://www.npmjs.com/package/libhoney,honeycombci,https://www.npmjs.com/~honeycombci, Honeycomb.io Javascript library
peggy,5.1.0,https://www.npmjs.com/package/peggy,GitHub Actions,https://www.npmjs.com/~GitHub Actions,Parser generator for JavaScript
regenerate,1.4.2,https://www.npmjs.com/package/regenerate,mathias,https://www.npmjs.com/~mathias,Generate JavaScript-compatible regular expressions based on a given set of Unicode symbols or code points.
curve25519-js,0.0.4,https://www.npmjs.com/package/curve25519-js,harveyconnor,https://www.npmjs.com/~harveyconnor,Javascript implementation of Curve25519
object-sizeof,2.6.5,https://www.npmjs.com/package/object-sizeof,miktam,https://www.npmjs.com/~miktam,Sizeof of a JavaScript object in Bytes
date-fns-jalali,4.1.0-0,https://www.npmjs.com/package/date-fns-jalali,smmoosavi,https://www.npmjs.com/~smmoosavi,Modern JavaScript date utility library for jalali calendar
typesense,3.0.6,https://www.npmjs.com/package/typesense,tharropoulos,https://www.npmjs.com/~tharropoulos,Javascript Library for Typesense
@asyncapi/parser,3.6.0,https://www.npmjs.com/package/@asyncapi/parser,GitHub Actions,https://www.npmjs.com/~GitHub Actions,JavaScript AsyncAPI parser.
@tracetail/js,2.3.11,https://www.npmjs.com/package/@tracetail/js,tracetail-publisher,https://www.npmjs.com/~tracetail-publisher,TraceTail JavaScript SDK for browser fingerprinting
@esbuild/freebsd-arm64,0.28.0,https://www.npmjs.com/package/@esbuild/freebsd-arm64,GitHub Actions,https://www.npmjs.com/~GitHub Actions,"The FreeBSD ARM 64-bit binary for esbuild, a JavaScript bundler."
dpop,2.1.1,https://www.npmjs.com/package/dpop,panva,https://www.npmjs.com/~panva,DPoP (RFC9449) for JavaScript Runtimes
estree-util-is-identifier-name,3.0.0,https://www.npmjs.com/package/estree-util-is-identifier-name,wooorm,https://www.npmjs.com/~wooorm,Check if something can be an ecmascript (javascript) identifier name
velocity-animate,1.5.2,https://www.npmjs.com/package/velocity-animate,rycochet,https://www.npmjs.com/~rycochet,Accelerated JavaScript animation.
@solana/assertions,6.8.0,https://www.npmjs.com/package/@solana/assertions,GitHub Actions,https://www.npmjs.com/~GitHub Actions,Helpers for asserting that a JavaScript environment supports certain features necessary for the operation of the Solana JavaScript SDK
neo4j-driver,6.0.1,https://www.npmjs.com/package/neo4j-driver,neo4j-organization,https://www.npmjs.com/~neo4j-organization,The official Neo4j driver for Javascript
@esbuild/linux-loong64,0.28.0,https://www.npmjs.com/package/@esbuild/linux-loong64,GitHub Actions,https://www.npmjs.com/~GitHub Actions,"The Linux LoongArch 64-bit binary for esbuild, a JavaScript bundler."
js-confuser,2.0.1,https://www.npmjs.com/package/js-confuser,michaelxf,https://www.npmjs.com/~michaelxf,JavaScript Obfuscation Tool.
@sendbird/chat,4.22.1,https://www.npmjs.com/package/@sendbird/chat,GitHub Actions,https://www.npmjs.com/~GitHub Actions,Sendbird SDK for JavaScript
yaml-types,0.4.0,https://www.npmjs.com/package/yaml-types,eemeli,https://www.npmjs.com/~eemeli,Useful JavaScript types for YAML
node-forge,1.4.0,https://www.npmjs.com/package/node-forge,davidlehn,https://www.npmjs.com/~davidlehn,"JavaScript implementations of network transports, cryptography, ciphers, PKI, message digests, and various utilities."
@honeybadger-io/core,6.7.2,https://www.npmjs.com/package/@honeybadger-io/core,joshuap,https://www.npmjs.com/~joshuap,JavaScript error notifier for Honeybadger.io
typpy,2.4.0,https://www.npmjs.com/package/typpy,ionicabizau,https://www.npmjs.com/~ionicabizau,A better typeof for JavaScript.
bit-twiddle,1.0.2,https://www.npmjs.com/package/bit-twiddle,mikolalysenko,https://www.npmjs.com/~mikolalysenko,Bit twiddling hacks for JavaScript
testem,3.20.0,https://www.npmjs.com/package/testem,johanneswuerbach,https://www.npmjs.com/~johanneswuerbach,Test'em 'scripts! Javascript Unit testing made easy.
pbf,4.0.1,https://www.npmjs.com/package/pbf,mapbox-npm-02,https://www.npmjs.com/~mapbox-npm-02,"a low-level, lightweight protocol buffers implementation in JavaScript"
gl-matrix,3.4.4,https://www.npmjs.com/package/gl-matrix,toji,https://www.npmjs.com/~toji,Javascript Matrix and Vector library for High Performance WebGL apps
@coinbase/wallet-sdk,4.3.7,https://www.npmjs.com/package/@coinbase/wallet-sdk,coinbase-npm,https://www.npmjs.com/~coinbase-npm,Coinbase Wallet JavaScript SDK
deepmerge,4.3.1,https://www.npmjs.com/package/deepmerge,tehshrike,https://www.npmjs.com/~tehshrike,A library for deep (recursive) merging of Javascript objects
swarm-js,0.1.42,https://www.npmjs.com/package/swarm-js,maiavictor,https://www.npmjs.com/~maiavictor,Swarm tools for JavaScript.
gulp-babel,8.0.0,https://www.npmjs.com/package/gulp-babel,loganfsmyth,https://www.npmjs.com/~loganfsmyth,"Use next generation JavaScript, today"
super-three,0.181.0,https://www.npmjs.com/package/super-three,dmarcos,https://www.npmjs.com/~dmarcos,JavaScript 3D library
@aws-amplify/amplify-frontend-javascript,3.10.25,https://www.npmjs.com/package/@aws-amplify/amplify-frontend-javascript,aws-amplify-ops,https://www.npmjs.com/~aws-amplify-ops,amplify-cli front-end plugin for JavaScript projects
qr-scanner,1.4.2,https://www.npmjs.com/package/qr-scanner,danimoh,https://www.npmjs.com/~danimoh,A javascript QR scanner library
super-animejs,3.1.0,https://www.npmjs.com/package/super-animejs,ngokevin,https://www.npmjs.com/~ngokevin,JavaScript animation engine
@types/javascript-color-gradient,2.4.2,https://www.npmjs.com/package/@types/javascript-color-gradient,types,https://www.npmjs.com/~types,TypeScript definitions for javascript-color-gradient
raphael,2.3.0,https://www.npmjs.com/package/raphael,talabes,https://www.npmjs.com/~talabes,JavaScript Vector Library
apify-client,2.23.0,https://www.npmjs.com/package/apify-client,GitHub Actions,https://www.npmjs.com/~GitHub Actions,Apify API client for JavaScript
microsoft-cognitiveservices-speech-sdk,1.49.0,https://www.npmjs.com/package/microsoft-cognitiveservices-speech-sdk,microsoft1es,https://www.npmjs.com/~microsoft1es,Microsoft Cognitive Services Speech SDK for JavaScript
graphql-tag,2.12.6,https://www.npmjs.com/package/graphql-tag,apollo-bot,https://www.npmjs.com/~apollo-bot,A JavaScript template literal tag that parses GraphQL queries
pdfmake,0.3.7,https://www.npmjs.com/package/pdfmake,GitHub Actions,https://www.npmjs.com/~GitHub Actions,Client/server side PDF printing in pure JavaScript
@directus/sdk,21.2.2,https://www.npmjs.com/package/@directus/sdk,GitHub Actions,https://www.npmjs.com/~GitHub Actions,Directus JavaScript SDK
@posthog/types,1.372.3,https://www.npmjs.com/package/@posthog/types,GitHub Actions,https://www.npmjs.com/~GitHub Actions,Type definitions for the PostHog JavaScript SDK
graphemer,1.4.0,https://www.npmjs.com/package/graphemer,mattpauldavies,https://www.npmjs.com/~mattpauldavies,A JavaScript library that breaks strings into their individual user-perceived characters (including emojis!)
amplitude-js,8.21.10,https://www.npmjs.com/package/amplitude-js,GitHub Actions,https://www.npmjs.com/~GitHub Actions,Javascript library for Amplitude Analytics
tcomb,3.2.29,https://www.npmjs.com/package/tcomb,gcanti,https://www.npmjs.com/~gcanti,Type checking and DDD for JavaScript
estree-util-to-js,2.0.0,https://www.npmjs.com/package/estree-util-to-js,wooorm,https://www.npmjs.com/~wooorm,estree (and esast) utility to serialize to JavaScript
ses,2.0.0,https://www.npmjs.com/package/ses,mhofman,https://www.npmjs.com/~mhofman,Hardened JavaScript for Fearless Cooperation
make-plural,8.1.0,https://www.npmjs.com/package/make-plural,eemeli,https://www.npmjs.com/~eemeli,Unicode CLDR pluralization rules as JavaScript functions
contentstack,3.27.0,https://www.npmjs.com/package/contentstack,cloudaccounts,https://www.npmjs.com/~cloudaccounts,Contentstack Javascript SDK
@tavily/core,0.7.3,https://www.npmjs.com/package/@tavily/core,tomer-yaacoby,https://www.npmjs.com/~tomer-yaacoby,Official JavaScript library for Tavily.
protocol-buffers-schema,3.6.1,https://www.npmjs.com/package/protocol-buffers-schema,mafintosh,https://www.npmjs.com/~mafintosh,No nonsense protocol buffers schema parser written in Javascript
bonjour,3.5.1,https://www.npmjs.com/package/bonjour,watson,https://www.npmjs.com/~watson,A Bonjour/Zeroconf implementation in pure JavaScript
@metaplex-foundation/mpl-token-metadata,3.4.0,https://www.npmjs.com/package/@metaplex-foundation/mpl-token-metadata,svc01-metaplex,https://www.npmjs.com/~svc01-metaplex,JavaScript client for Token Metadata
glightbox,3.3.1,https://www.npmjs.com/package/glightbox,biati,https://www.npmjs.com/~biati,Pure Javascript lightbox
tcomb-validation,3.4.1,https://www.npmjs.com/package/tcomb-validation,gcanti,https://www.npmjs.com/~gcanti,General purpose validation library for JavaScript
@azure/monitor-opentelemetry-exporter,1.0.0-beta.32,https://www.npmjs.com/package/@azure/monitor-opentelemetry-exporter,microsoft1es,https://www.npmjs.com/~microsoft1es,Application Insights exporter for the OpenTelemetry JavaScript (Node.js) SDK
tdigest,0.1.2,https://www.npmjs.com/package/tdigest,welch,https://www.npmjs.com/~welch,javascript implementation of Dunning's T-Digest for streaming quantile approximation
power-assert,1.6.1,https://www.npmjs.com/package/power-assert,twada,https://www.npmjs.com/~twada,Power Assert in JavaScript
@esbuild/openbsd-arm64,0.28.0,https://www.npmjs.com/package/@esbuild/openbsd-arm64,GitHub Actions,https://www.npmjs.com/~GitHub Actions,"The OpenBSD ARM 64-bit binary for esbuild, a JavaScript bundler."
jss,10.10.0,https://www.npmjs.com/package/jss,kof,https://www.npmjs.com/~kof,A lib for generating Style Sheets with JavaScript.
map-or-similar,1.5.0,https://www.npmjs.com/package/map-or-similar,thinkloop,https://www.npmjs.com/~thinkloop,A JavaScript (JS) Map or Similar object polyfill if Map is not available.
@trysound/sax,0.2.0,https://www.npmjs.com/package/@trysound/sax,trysound,https://www.npmjs.com/~trysound,An evented streaming XML parser in JavaScript
@joint/core,4.2.4,https://www.npmjs.com/package/@joint/core,joint_admin,https://www.npmjs.com/~joint_admin,JavaScript diagramming library
vue,3.5.33,https://www.npmjs.com/package/vue,GitHub Actions,https://www.npmjs.com/~GitHub Actions,The progressive JavaScript framework for building modern web UI.
scope-analyzer,2.1.2,https://www.npmjs.com/package/scope-analyzer,goto-bus-stop,https://www.npmjs.com/~goto-bus-stop,simple scope analysis for javascript ASTs
msrcrypto,1.5.8,https://www.npmjs.com/package/msrcrypto,kevlened,https://www.npmjs.com/~kevlened,MSR JavaScript Cryptography Library
@pact-foundation/pact,16.3.0,https://www.npmjs.com/package/@pact-foundation/pact,GitHub Actions,https://www.npmjs.com/~GitHub Actions,Pact for all things Javascript
react-refresh,0.18.0,https://www.npmjs.com/package/react-refresh,react-bot,https://www.npmjs.com/~react-bot,React is a JavaScript library for building user interfaces.
json2mq,0.2.0,https://www.npmjs.com/package/json2mq,akiran,https://www.npmjs.com/~akiran,Generate media query string from JSON or javascript object
fast-png,8.0.0,https://www.npmjs.com/package/fast-png,cheminfo-bot,https://www.npmjs.com/~cheminfo-bot,PNG image decoder and encoder written entirely in JavaScript
obj-props,2.0.0,https://www.npmjs.com/package/obj-props,dustinspecker,https://www.npmjs.com/~dustinspecker,List of properties for JavaScript objects
