Package Name,Version,Official Link,Creator,Creator Profile Link,Description
jszip,3.10.1,https://www.npmjs.com/package/jszip,stuk,https://www.npmjs.com/~stuk,"Create, read and edit .zip files with JavaScript http://stuartk.com/jszip"
msgpack-lite,0.1.26,https://www.npmjs.com/package/msgpack-lite,kawanet,https://www.npmjs.com/~kawanet,Fast Pure JavaScript MessagePack Encoder and Decoder
@elevenlabs/client,1.3.1,https://www.npmjs.com/package/@elevenlabs/client,GitHub Actions,https://www.npmjs.com/~GitHub Actions,ElevenLabs JavaScript Client Library
@solana-program/token-2022,0.9.0,https://www.npmjs.com/package/@solana-program/token-2022,joncinque,https://www.npmjs.com/~joncinque,JavaScript client for the Token 2022 program
@oxfmt/binding-linux-x64-musl,0.47.0,https://www.npmjs.com/package/@oxfmt/binding-linux-x64-musl,GitHub Actions,https://www.npmjs.com/~GitHub Actions,Formatter for the JavaScript Oxidation Compiler
parse,8.6.0,https://www.npmjs.com/package/parse,parseadmin,https://www.npmjs.com/~parseadmin,Parse JavaScript SDK
with,7.0.2,https://www.npmjs.com/package/with,with-bot,https://www.npmjs.com/~with-bot,Compile time `with` for strict mode JavaScript
grunt-contrib-uglify,5.2.2,https://www.npmjs.com/package/grunt-contrib-uglify,vladikoff,https://www.npmjs.com/~vladikoff,Minify JavaScript files with UglifyJS
@getstoryteller/storyteller-sdk-javascript,10.13.2,https://www.npmjs.com/package/@getstoryteller/storyteller-sdk-javascript,fraserb99,https://www.npmjs.com/~fraserb99,Javascript SDK for Storyteller
@esbuild/linux-riscv64,0.28.0,https://www.npmjs.com/package/@esbuild/linux-riscv64,GitHub Actions,https://www.npmjs.com/~GitHub Actions,"The Linux RISC-V 64-bit binary for esbuild, a JavaScript bundler."
@esbuild/netbsd-arm64,0.28.0,https://www.npmjs.com/package/@esbuild/netbsd-arm64,GitHub Actions,https://www.npmjs.com/~GitHub Actions,"The NetBSD ARM 64-bit binary for esbuild, a JavaScript bundler."
@solana-program/compute-budget,0.15.0,https://www.npmjs.com/package/@solana-program/compute-budget,joncinque,https://www.npmjs.com/~joncinque,JavaScript client for the Compute Budget program
logrocket,12.1.1,https://www.npmjs.com/package/logrocket,logrocket-npm,https://www.npmjs.com/~logrocket-npm,JavaScript SDK for [LogRocket](https://logrocket.com/)
iterall,1.3.0,https://www.npmjs.com/package/iterall,leebyron,https://www.npmjs.com/~leebyron,Minimal zero-dependency utilities for using JavaScript Iterables in all environments.
scriptjs,2.5.9,https://www.npmjs.com/package/scriptjs,ded,https://www.npmjs.com/~ded,Asyncronous JavaScript loader and dependency manager
@heap/heap-javascript-bridge-support,0.6.0,https://www.npmjs.com/package/@heap/heap-javascript-bridge-support,brian-heap,https://www.npmjs.com/~brian-heap,Heap bridge helper for implementing JavaScript sdks on native platforms.
xmldoc,2.0.3,https://www.npmjs.com/package/xmldoc,nfarina,https://www.npmjs.com/~nfarina,A lightweight XML Document class for JavaScript.
html2canvas-pro,2.0.2,https://www.npmjs.com/package/html2canvas-pro,yorickshan,https://www.npmjs.com/~yorickshan,Screenshots with JavaScript. Next generation!
@hawk.so/javascript,3.2.21,https://www.npmjs.com/package/@hawk.so/javascript,codex-team,https://www.npmjs.com/~codex-team,JavaScript errors tracking for Hawk.so
dpdm,4.0.1,https://www.npmjs.com/package/dpdm,acrazing,https://www.npmjs.com/~acrazing,Analyze circular dependencies in your JavaScript/TypeScript projects.
rttc,10.0.1,https://www.npmjs.com/package/rttc,rachaelshaw,https://www.npmjs.com/~rachaelshaw,Runtime type-checking for JavaScript.
extend-shallow,3.0.2,https://www.npmjs.com/package/extend-shallow,phated,https://www.npmjs.com/~phated,Extend an object with the properties of additional objects. node.js/javascript util.
base62,2.0.2,https://www.npmjs.com/package/base62,andrewnez,https://www.npmjs.com/~andrewnez,JavaScript Base62 encode/decoder
class-utils,0.3.6,https://www.npmjs.com/package/class-utils,jonschlinkert,https://www.npmjs.com/~jonschlinkert,Utils for working with JavaScript classes and prototype methods.
esbuild-linux-64,0.15.18,https://www.npmjs.com/package/esbuild-linux-64,evanw,https://www.npmjs.com/~evanw,"The Linux 64-bit binary for esbuild, a JavaScript bundler."
@supabase/phoenix,0.4.1,https://www.npmjs.com/package/@supabase/phoenix,GitHub Actions,https://www.npmjs.com/~GitHub Actions,The official JavaScript client for the Phoenix web framework.
onnx-proto,8.0.1,https://www.npmjs.com/package/onnx-proto,chaosmail,https://www.npmjs.com/~chaosmail,Onnx Protobuf definition for JavaScript
pegjs,0.10.0,https://www.npmjs.com/package/pegjs,dmajda,https://www.npmjs.com/~dmajda,Parser generator for JavaScript
@amplitude/types,1.10.2,https://www.npmjs.com/package/@amplitude/types,sdk.dev,https://www.npmjs.com/~sdk.dev,Types for all Amplitude JavaScript SDKs
heap-js,2.7.1,https://www.npmjs.com/package/heap-js,ignlg,https://www.npmjs.com/~ignlg,"Efficient Binary heap (priority queue, binary tree) data structure for JavaScript / TypeScript. Includes JavaScript methods, Python's heapq module methods, and Java's PriorityQueue methods."
@aws-sdk/client-s3,3.1038.0,https://www.npmjs.com/package/@aws-sdk/client-s3,aws-sdk-bot,https://www.npmjs.com/~aws-sdk-bot,"AWS SDK for JavaScript S3 Client for Node.js, Browser and React Native"
modal,0.7.4,https://www.npmjs.com/package/modal,GitHub Actions,https://www.npmjs.com/~GitHub Actions,Modal SDK for JavaScript/TypeScript
@esbuild/aix-ppc64,0.28.0,https://www.npmjs.com/package/@esbuild/aix-ppc64,GitHub Actions,https://www.npmjs.com/~GitHub Actions,"The IBM AIX PowerPC 64-bit binary for esbuild, a JavaScript bundler."
@fingerprintjs/fingerprintjs-pro,3.12.9,https://www.npmjs.com/package/@fingerprintjs/fingerprintjs-pro,GitHub Actions,https://www.npmjs.com/~GitHub Actions,Fingerprint JavaScript agent
@adora-so/adora-js,0.1.94,https://www.npmjs.com/package/@adora-so/adora-js,george-adora,https://www.npmjs.com/~george-adora,Adora JavaScript SDK
@openrewrite/rewrite,8.81.0,https://www.npmjs.com/package/@openrewrite/rewrite,zieka,https://www.npmjs.com/~zieka,OpenRewrite JavaScript.
postcss-functions,4.0.2,https://www.npmjs.com/package/postcss-functions,andyjansson,https://www.npmjs.com/~andyjansson,PostCSS plugin for exposing JavaScript functions
youch,4.1.1,https://www.npmjs.com/package/youch,GitHub Actions,https://www.npmjs.com/~GitHub Actions,Pretty print JavaScript errors on the Web and the Terminal
merge-deep,3.0.3,https://www.npmjs.com/package/merge-deep,doowb,https://www.npmjs.com/~doowb,Recursively merge values in a javascript object.
o3,1.0.3,https://www.npmjs.com/package/o3,inf3rno,https://www.npmjs.com/~inf3rno,o3 - Javascript Class Framework
javascript-playgrounds,1.2.8,https://www.npmjs.com/package/javascript-playgrounds,dabbott,https://www.npmjs.com/~dabbott,Interactive JavaScript sandbox
rsocket-flowable,0.0.29-alpha.0,https://www.npmjs.com/package/rsocket-flowable,viglucci,https://www.npmjs.com/~viglucci,ReactiveStreams for JavaScript
@tensorflow/tfjs-backend-cpu,4.22.0,https://www.npmjs.com/package/@tensorflow/tfjs-backend-cpu,delhibabu,https://www.npmjs.com/~delhibabu,Vanilla JavaScript backend for TensorFlow.js
bwip-js,4.10.1,https://www.npmjs.com/package/bwip-js,bwip-js,https://www.npmjs.com/~bwip-js,JavaScript barcode generator supporting over 100 types and standards.
ffjavascript,0.3.1,https://www.npmjs.com/package/ffjavascript,obrezhniev,https://www.npmjs.com/~obrezhniev,Finite Field Library in Javascript
styleq,0.2.1,https://www.npmjs.com/package/styleq,necolas,https://www.npmjs.com/~necolas,A quick JavaScript runtime for Atomic CSS compilers.
@descope/core-js-sdk,2.59.1,https://www.npmjs.com/package/@descope/core-js-sdk,omercnet,https://www.npmjs.com/~omercnet,Descope JavaScript core SDK
@wojtekmaj/enzyme-adapter-react-17,0.8.0,https://www.npmjs.com/package/@wojtekmaj/enzyme-adapter-react-17,wojtekmaj,https://www.npmjs.com/~wojtekmaj,JavaScript Testing utilities for React
is-identifier,1.0.1,https://www.npmjs.com/package/is-identifier,sindresorhus,https://www.npmjs.com/~sindresorhus,Check if a string is a valid JavaScript identifier
dijkstrajs,1.0.3,https://www.npmjs.com/package/dijkstrajs,tcort,https://www.npmjs.com/~tcort,A simple JavaScript implementation of Dijkstra's single-source shortest-paths algorithm.
@form8ion/javascript,15.8.3,https://www.npmjs.com/package/@form8ion/javascript,GitHub Actions,https://www.npmjs.com/~GitHub Actions,JavaScript language plugin for the @form8ion toolset
webpack-obfuscator,3.6.1,https://www.npmjs.com/package/webpack-obfuscator,sanex3339,https://www.npmjs.com/~sanex3339,javascript-obfuscator plugin for Webpack@5
v8n,1.5.1,https://www.npmjs.com/package/v8n,bruno02221,https://www.npmjs.com/~bruno02221,Dead simple fluent JavaScript validation library
micromatch,4.0.8,https://www.npmjs.com/package/micromatch,doowb,https://www.npmjs.com/~doowb,Glob matching for javascript/node.js. A replacement and faster alternative to minimatch and multimatch.
rudder-sdk-js,2.52.11,https://www.npmjs.com/package/rudder-sdk-js,GitHub Actions,https://www.npmjs.com/~GitHub Actions,RudderStack JavaScript SDK
concordance,5.0.4,https://www.npmjs.com/package/concordance,novemberborn,https://www.npmjs.com/~novemberborn,"Compare, format, diff and serialize any JavaScript value"
seek-bzip,2.0.0,https://www.npmjs.com/package/seek-bzip,cscott,https://www.npmjs.com/~cscott,a pure-JavaScript Node.JS module for random-access decoding bzip2 data
memory-fs,0.5.0,https://www.npmjs.com/package/memory-fs,sokra,https://www.npmjs.com/~sokra,A simple in-memory filesystem. Holds data in a javascript object.
sjcl,1.0.9,https://www.npmjs.com/package/sjcl,nilos,https://www.npmjs.com/~nilos,Stanford Javascript Crypto Library
blake3-wasm,3.0.0,https://www.npmjs.com/package/blake3-wasm,connor.peet,https://www.npmjs.com/~connor.peet,BLAKE3 hashing for JavaScript: WebAssembly bindings only
parse-srcset,1.0.2,https://www.npmjs.com/package/parse-srcset,albell,https://www.npmjs.com/~albell,A spec-conformant JavaScript parser for the HTML5 srcset attribute
@esbuild/linux-mips64el,0.28.0,https://www.npmjs.com/package/@esbuild/linux-mips64el,GitHub Actions,https://www.npmjs.com/~GitHub Actions,"The Linux MIPS 64-bit Little Endian binary for esbuild, a JavaScript bundler."
@types/javascript-state-machine,2.4.6,https://www.npmjs.com/package/@types/javascript-state-machine,types,https://www.npmjs.com/~types,TypeScript definitions for javascript-state-machine
isomorphic.js,0.2.5,https://www.npmjs.com/package/isomorphic.js,dmonad,https://www.npmjs.com/~dmonad,"Isomorphic JavaScript helper functions (performance, crpyto, ..)"
@amplitude/experiment-core,0.13.0,https://www.npmjs.com/package/@amplitude/experiment-core,GitHub Actions,https://www.npmjs.com/~GitHub Actions,Amplitude Experiment evaluation JavaScript implementation.
object-hash,3.0.0,https://www.npmjs.com/package/object-hash,addaleax,https://www.npmjs.com/~addaleax,Generate hashes from javascript objects in node and the browser.
firebase,12.12.1,https://www.npmjs.com/package/firebase,google-wombot,https://www.npmjs.com/~google-wombot,Firebase JavaScript library for web and Node.js
speedometer,1.1.0,https://www.npmjs.com/package/speedometer,mafintosh,https://www.npmjs.com/~mafintosh,simple speed measurement in javascript
graphology,0.26.0,https://www.npmjs.com/package/graphology,yomguithereal,https://www.npmjs.com/~yomguithereal,A robust and multipurpose Graph object for JavaScript.
solid-js,1.9.12,https://www.npmjs.com/package/solid-js,ryansolid,https://www.npmjs.com/~ryansolid,A declarative JavaScript library for building user interfaces.
culori,4.0.2,https://www.npmjs.com/package/culori,danburzo,https://www.npmjs.com/~danburzo,A general-purpose color library for JavaScript
@solana-program/stake,0.6.0,https://www.npmjs.com/package/@solana-program/stake,joncinque,https://www.npmjs.com/~joncinque,JavaScript client for the Stake program
didi,11.0.0,https://www.npmjs.com/package/didi,nikku,https://www.npmjs.com/~nikku,Dependency Injection for JavaScript
ag-charts-community,13.2.1,https://www.npmjs.com/package/ag-charts-community,GitHub Actions,https://www.npmjs.com/~GitHub Actions,Advanced Charting / Charts supporting Javascript / Typescript / React / Angular / Vue
@antfu/utils,9.3.0,https://www.npmjs.com/package/@antfu/utils,GitHub Actions,https://www.npmjs.com/~GitHub Actions,Opinionated collection of common JavaScript / TypeScript utils by @antfu
common-js-file-extensions,1.0.4,https://www.npmjs.com/package/common-js-file-extensions,luislobo,https://www.npmjs.com/~luislobo,Common JavaScript File Extensions
syncpack,14.3.1,https://www.npmjs.com/package/syncpack,GitHub Actions,https://www.npmjs.com/~GitHub Actions,Consistent dependency versions in large JavaScript Monorepos
@tensorflow/tfjs-converter,4.22.0,https://www.npmjs.com/package/@tensorflow/tfjs-converter,delhibabu,https://www.npmjs.com/~delhibabu,Tensorflow model converter for javascript
@nyariv/sandboxjs,0.9.5,https://www.npmjs.com/package/@nyariv/sandboxjs,GitHub Actions,https://www.npmjs.com/~GitHub Actions,Javascript sandboxing library.
gifuct-js,2.1.2,https://www.npmjs.com/package/gifuct-js,matt-syntropy,https://www.npmjs.com/~matt-syntropy,Easy to use efficient .GIF parsing in javascript
tabulator-tables,6.4.0,https://www.npmjs.com/package/tabulator-tables,olifolkerd,https://www.npmjs.com/~olifolkerd,Interactive table generation JavaScript library
@esbuild/linux-ppc64,0.28.0,https://www.npmjs.com/package/@esbuild/linux-ppc64,GitHub Actions,https://www.npmjs.com/~GitHub Actions,"The Linux PowerPC 64-bit Little Endian binary for esbuild, a JavaScript bundler."
@cypress/webpack-preprocessor,7.1.0,https://www.npmjs.com/package/@cypress/webpack-preprocessor,cypress-npm-publisher,https://www.npmjs.com/~cypress-npm-publisher,Cypress preprocessor for bundling JavaScript via webpack
@testmo/testmo-api,2.5.0,https://www.npmjs.com/package/@testmo/testmo-api,abhandari-25,https://www.npmjs.com/~abhandari-25,Testmo REST API JavaScript binding
fundebug-javascript,2.8.8,https://www.npmjs.com/package/fundebug-javascript,fundebug,https://www.npmjs.com/~fundebug,monitor errors of javascript application
@wojtekmaj/enzyme-adapter-utils,0.2.0,https://www.npmjs.com/package/@wojtekmaj/enzyme-adapter-utils,wojtekmaj,https://www.npmjs.com/~wojtekmaj,JavaScript Testing utilities for React
@bugsnag/js,8.9.0,https://www.npmjs.com/package/@bugsnag/js,sb-priyankap,https://www.npmjs.com/~sb-priyankap,"Universal Javascript error reporting. Automatically detect JavaScript errors in the browser and Node.js, with plugins for React, Vue, Angular, Express, Restify and Koa."
nanotar,0.3.0,https://www.npmjs.com/package/nanotar,pi0,https://www.npmjs.com/~pi0,Tiny and fast Tar utils for any JavaScript runtime!
qrcode-generator,2.0.4,https://www.npmjs.com/package/qrcode-generator,kazuhikoarase,https://www.npmjs.com/~kazuhikoarase,QR Code Generator implementation in JavaScript.
ag-grid-community,35.2.1,https://www.npmjs.com/package/ag-grid-community,GitHub Actions,https://www.npmjs.com/~GitHub Actions,Advanced Data Grid / Data Table supporting Javascript / Typescript / React / Angular / Vue
@lemonsqueezy/lemonsqueezy.js,4.0.0,https://www.npmjs.com/package/@lemonsqueezy/lemonsqueezy.js,brankoconjic,https://www.npmjs.com/~brankoconjic,The official Lemon Squeezy JavaScript SDK.
numeric,1.2.6,https://www.npmjs.com/package/numeric,Unknown,N/A,Numerical analysis in javascript
@fastly/js-compute,3.41.1,https://www.npmjs.com/package/@fastly/js-compute,GitHub Actions,https://www.npmjs.com/~GitHub Actions,JavaScript SDK and CLI for building JavaScript applications on [Fastly Compute](https://www.fastly.com/products/edge-compute/serverless).
@auth0/auth0-auth-js,1.6.0,https://www.npmjs.com/package/@auth0/auth0-auth-js,GitHub Actions,https://www.npmjs.com/~GitHub Actions,Auth0 Authentication Client for JavaScript runtimes.
eslint-config-semistandard,17.0.0,https://www.npmjs.com/package/eslint-config-semistandard,voxpelli,https://www.npmjs.com/~voxpelli,JavaScript Semistandard Style - ESLint Shareable Config
unenv,1.10.0,https://www.npmjs.com/package/unenv,pi0,https://www.npmjs.com/~pi0,"`unenv` is a framework-agnostic system that allows converting JavaScript code to be platform agnostic and work in any environment including Browsers, Workers, Node.js, or JavaScript runtime."
javascript-astar,0.4.1,https://www.npmjs.com/package/javascript-astar,bgrins,https://www.npmjs.com/~bgrins,astar search algorithm in JavaScript
remeda,2.34.0,https://www.npmjs.com/package/remeda,GitHub Actions,https://www.npmjs.com/~GitHub Actions,A utility library for JavaScript and Typescript.
kinvey-js-sdk,8.0.0,https://www.npmjs.com/package/kinvey-js-sdk,tsakata1,https://www.npmjs.com/~tsakata1,Kinvey JavaScript SDK for JavaScript applications.
smartapi-javascript,1.0.27,https://www.npmjs.com/package/smartapi-javascript,ab-smartapi,https://www.npmjs.com/~ab-smartapi,"```bash npm i smartapi-javascript ```"
microcms-js-sdk,3.4.0,https://www.npmjs.com/package/microcms-js-sdk,GitHub Actions,https://www.npmjs.com/~GitHub Actions,JavaScript SDK Client for microCMS.
apg-js,4.4.0,https://www.npmjs.com/package/apg-js,ldthomas,https://www.npmjs.com/~ldthomas,"JavaScript APG, an ABNF Parser Generator"
howler,2.2.4,https://www.npmjs.com/package/howler,goldfire,https://www.npmjs.com/~goldfire,Javascript audio library for the modern web.
d3-cloud,1.2.9,https://www.npmjs.com/package/d3-cloud,jasondavies,https://www.npmjs.com/~jasondavies,Generate word clouds in JavaScript.
@solana/options,6.8.0,https://www.npmjs.com/package/@solana/options,GitHub Actions,https://www.npmjs.com/~GitHub Actions,Managing and serializing Rust-like Option types in JavaScript
environment,1.1.0,https://www.npmjs.com/package/environment,sindresorhus,https://www.npmjs.com/~sindresorhus,"Check which JavaScript environment your code is running in at runtime: browser, Node.js, Bun, etc"
avro-js,1.12.1,https://www.npmjs.com/package/avro-js,opwvhk,https://www.npmjs.com/~opwvhk,JavaScript Avro implementation
@fal-ai/client,1.10.0,https://www.npmjs.com/package/@fal-ai/client,GitHub Actions,https://www.npmjs.com/~GitHub Actions,The fal.ai client for JavaScript and TypeScript
@petamoriken/float16,3.9.3,https://www.npmjs.com/package/@petamoriken/float16,GitHub Actions,https://www.npmjs.com/~GitHub Actions,IEEE 754 half-precision floating-point for JavaScript
mutative,1.3.0,https://www.npmjs.com/package/mutative,unadlib,https://www.npmjs.com/~unadlib,A JavaScript library for efficient immutable updates
@azure/storage-file-share,12.30.0,https://www.npmjs.com/package/@azure/storage-file-share,microsoft1es,https://www.npmjs.com/~microsoft1es,Microsoft Azure Storage SDK for JavaScript - File
replicator,1.0.5,https://www.npmjs.com/package/replicator,belym.a.2105,https://www.npmjs.com/~belym.a.2105,Advanced JavaScript objects serialization.
@descope/web-js-sdk,1.48.1,https://www.npmjs.com/package/@descope/web-js-sdk,omercnet,https://www.npmjs.com/~omercnet,Descope JavaScript web SDK
@pnpm/ramda,0.28.1,https://www.npmjs.com/package/@pnpm/ramda,zkochan,https://www.npmjs.com/~zkochan,A practical functional library for JavaScript programmers.
tv4,1.3.0,https://www.npmjs.com/package/tv4,geraintluff,https://www.npmjs.com/~geraintluff,A public domain JSON Schema validator for JavaScript
checkpoint-client,1.1.33,https://www.npmjs.com/package/checkpoint-client,prismabot,https://www.npmjs.com/~prismabot,javascript checkpoint client
probe.gl,3.6.0,https://www.npmjs.com/package/probe.gl,ibgreen,https://www.npmjs.com/~ibgreen,JavaScript console instrumentation for browser and Node
@aws-sdk/client-sso,3.1038.0,https://www.npmjs.com/package/@aws-sdk/client-sso,aws-sdk-bot,https://www.npmjs.com/~aws-sdk-bot,"AWS SDK for JavaScript Sso Client for Node.js, Browser and React Native"
simple-keyboard,3.8.136,https://www.npmjs.com/package/simple-keyboard,GitHub Actions,https://www.npmjs.com/~GitHub Actions,On-screen Javascript Virtual Keyboard
@rollup/plugin-swc,0.4.0,https://www.npmjs.com/package/@rollup/plugin-swc,shellscape,https://www.npmjs.com/~shellscape,Transpile JavaScript/TypeScript code with swc.
@axiomhq/js,1.6.0,https://www.npmjs.com/package/@axiomhq/js,GitHub Actions,https://www.npmjs.com/~GitHub Actions,The official javascript bindings for the Axiom API
@trezor/utxo-lib,2.5.0,https://www.npmjs.com/package/@trezor/utxo-lib,GitHub Actions,https://www.npmjs.com/~GitHub Actions,Client-side Bitcoin-like JavaScript library
humanize,0.0.9,https://www.npmjs.com/package/humanize,taijin,https://www.npmjs.com/~taijin,Javascript string formatter for human readability
node-bitmap,0.0.1,https://www.npmjs.com/package/node-bitmap,nowelium,https://www.npmjs.com/~nowelium,pure javascript Bitmap library
javascript-autocomplete,1.0.5,https://www.npmjs.com/package/javascript-autocomplete,rascarlito,https://www.npmjs.com/~rascarlito,Pixabay JavaScript-autoComplete
hyparquet,1.25.6,https://www.npmjs.com/package/hyparquet,platypii,https://www.npmjs.com/~platypii,Parquet file parser for JavaScript
@openfga/sdk,0.9.5,https://www.npmjs.com/package/@openfga/sdk,GitHub Actions,https://www.npmjs.com/~GitHub Actions,JavaScript and Node.js SDK for OpenFGA
nwmatcher,1.4.4,https://www.npmjs.com/package/nwmatcher,diego,https://www.npmjs.com/~diego,A CSS3-compliant JavaScript selector engine.
vite-plugin-commonjs,0.10.4,https://www.npmjs.com/package/vite-plugin-commonjs,caoxie,https://www.npmjs.com/~caoxie,A pure JavaScript implementation of CommonJs
rx,4.1.0,https://www.npmjs.com/package/rx,mattpodwysocki,https://www.npmjs.com/~mattpodwysocki,Library for composing asynchronous and event-based operations in JavaScript
capability,0.2.5,https://www.npmjs.com/package/capability,inf3rno,https://www.npmjs.com/~inf3rno,capability.js - javascript environment capability detection
quickchart-js,3.1.3,https://www.npmjs.com/package/quickchart-js,ianw,https://www.npmjs.com/~ianw,Javascript client for QuickChart.io
airtable,0.12.2,https://www.npmjs.com/package/airtable,nabeelairtable,https://www.npmjs.com/~nabeelairtable,The official Airtable JavaScript library.
signalr,2.4.3,https://www.npmjs.com/package/signalr,brecon,https://www.npmjs.com/~brecon,Microsoft ASP.NET SignalR JavaScript Client
plotly.js,3.5.0,https://www.npmjs.com/package/plotly.js,packages-team-plotly,https://www.npmjs.com/~packages-team-plotly,The open source javascript graphing library that powers plotly
onnxruntime-web,1.24.3,https://www.npmjs.com/package/onnxruntime-web,onnxruntime,https://www.npmjs.com/~onnxruntime,A Javascript library for running ONNX models on browsers
replicate,1.4.0,https://www.npmjs.com/package/replicate,aron,https://www.npmjs.com/~aron,JavaScript client for Replicate
zlibjs,0.3.1,https://www.npmjs.com/package/zlibjs,imaya,https://www.npmjs.com/~imaya,"zlib, gzip and zip implementation in JavaScript"
@ngageoint/grid-js,2.1.0,https://www.npmjs.com/package/@ngageoint/grid-js,kgilland,https://www.npmjs.com/~kgilland,Grid Javascript
twilio-video,2.34.0,https://www.npmjs.com/package/twilio-video,twilio-video-npm,https://www.npmjs.com/~twilio-video-npm,Twilio Video JavaScript Library
delaunator,5.1.0,https://www.npmjs.com/package/delaunator,mourner,https://www.npmjs.com/~mourner,An incredibly fast JavaScript library for Delaunay triangulation of 2D points
error-polyfill,0.1.3,https://www.npmjs.com/package/error-polyfill,inf3rno,https://www.npmjs.com/~inf3rno,Javascript Error Polyfill
bun-types,1.3.13,https://www.npmjs.com/package/bun-types,jarred,https://www.npmjs.com/~jarred,"Type definitions and documentation for Bun, an incredibly fast JavaScript runtime"
@stytch/vanilla-js,6.0.7,https://www.npmjs.com/package/@stytch/vanilla-js,GitHub Actions,https://www.npmjs.com/~GitHub Actions,Stytch's official Javascript Client Library
ecpair,3.0.1,https://www.npmjs.com/package/ecpair,jl.landabaso,https://www.npmjs.com/~jl.landabaso,Client-side Bitcoin JavaScript library ECPair
@bitgo-forks/bitcoinjs-lib,7.0.0-rc.7,https://www.npmjs.com/package/@bitgo-forks/bitcoinjs-lib,ericcrosson-bitgo,https://www.npmjs.com/~ericcrosson-bitgo,Client-side Bitcoin JavaScript library
buildkite-test-collector,1.9.5,https://www.npmjs.com/package/buildkite-test-collector,nprizal,https://www.npmjs.com/~nprizal,Buildkite Test Engine collectors for JavaScript test frameworks
velocityjs,2.1.5,https://www.npmjs.com/package/velocityjs,shepherdwind,https://www.npmjs.com/~shepherdwind,Velocity Template Language(VTL) for JavaScript
@amplitude/utils,1.10.2,https://www.npmjs.com/package/@amplitude/utils,sdk.dev,https://www.npmjs.com/~sdk.dev,Utility functions for the Amplitude JavaScript SDK
@evidence-dev/source-javascript,0.0.3,https://www.npmjs.com/package/@evidence-dev/source-javascript,mcrascal,https://www.npmjs.com/~mcrascal,This is a JavaScript source for Evidence. It allows you to run arbitrary JavaScript code as a data source. It's a quick way to get data into Evidence without having to create a new connector.
tinymce,8.4.0,https://www.npmjs.com/package/tinymce,tinymce,https://www.npmjs.com/~tinymce,Web based JavaScript HTML WYSIWYG editor control.
deps-regex,0.2.0,https://www.npmjs.com/package/deps-regex,mathieudutour,https://www.npmjs.com/~mathieudutour,Regular expression for matching javascript require/import statements.
unload,2.4.1,https://www.npmjs.com/package/unload,pubkey,https://www.npmjs.com/~pubkey,Execute code when the js-process exits. On all javascript-environments
over,0.0.5,https://www.npmjs.com/package/over,Unknown,N/A,JavaScript function overloading framework.
algoliasearch,5.51.0,https://www.npmjs.com/package/algoliasearch,GitHub Actions,https://www.npmjs.com/~GitHub Actions,A fully-featured and blazing-fast JavaScript API client to interact with Algolia API.
